### ISSUE TITLE
named忽略了forwarder响应中CNAME名字关联的A记录

### ISSUE THREAD

**Issue by yousong** [ustclug/neatdns#12]
以`www.huawei.com`为例，`CHINA_DNS1`返回它的CNAME，直至解析到A记录。A记录中的地址指向国内

但是named的默认行为只取其中直接相关的CNAME，再根据zone配置继续查询，最终的效果是解析出的地址为国外地址，并且解析响应时较长

在neatdns的应用场景下，应该允许直接返回CHINA_DNS1的结果吧，像dnsmasq那样？

```
20:44:43.502289 IP 172.17.0.1.56625 > 172.17.0.7.53: 59570+ [1au] A? www.huawei.com. (43)
20:44:43.504004 IP 172.17.0.7.42238 > x.x.x.x.53: 18241+ A? www.huawei.com. (32)
20:44:43.506888 IP x.x.x.x.53 > 172.17.0.7.42238: 18241 4/0/0 CNAME www.huawei.com.akadns.net., CNAME www.huawei.com.lxdns.com., A 60.222.221.125, A 111.206.186.250 (138)
20:44:43.508651 IP 172.17.0.7.55259 > 8.8.4.4.53: 52641+% [1au] A? www.huawei.com.akadns.net. (66)
20:44:43.653994 IP 8.8.4.4.53 > 172.17.0.7.55259: 52641 3/0/1 CNAME ion-sslv6.huawei.com.edgekey.net., CNAME e10173.dsca.akamaiedge.net., A 184.51.184.239 (150)
20:44:43.655605 IP 172.17.0.7.34264 > 8.8.4.4.53: 51105+% [1au] A? ion-sslv6.huawei.com.edgekey.net. (73)
20:44:43.719259 IP 8.8.4.4.53 > 172.17.0.7.34264: 51105 2/0/1 CNAME e10173.dsca.akamaiedge.net., A 184.51.184.239 (114)
20:44:43.721277 IP 172.17.0.7.48331 > 8.8.4.4.53: 13692+% [1au] A? e10173.dsca.akamaiedge.net. (67)
20:44:43.787276 IP 8.8.4.4.53 > 172.17.0.7.48331: 13692 1/0/1 A 184.51.184.239 (71)
20:44:43.788431 IP 172.17.0.7.53 > 172.17.0.1.56625: 59570 4/0/1 CNAME www.huawei.com.akadns.net., CNAME ion-sslv6.huawei.com.edgekey.net., CNAME e10173.dsca.akamaiedge.net., A 184.51.184.239 (184)
```

**Comment by yousong** [comment]
用dnsmasq做了一个替代的，https://github.com/yousong/czdns
